title;author;journal;year;source;pages;volume;abstract;document_type;doi;url;selection_criteria;status;Keywords;domain_suggested
Machine learning prediction and analysis of students’ academic performance;Pasic, Mirza and Vatres, Ajdin and Ferizbegovic, Faris and Bajric, Hadis and Pasic, Mugdim;Periodicals of Engineering and Natural Sciences;2023;Scopus;27 – 46;11;Analyzing students’ academic performance is important for evaluating enrollment criteria which establish the standards required for pupils who finished secondary school to gain admission to a higher education institution. The aims of this research were to develop a machine learning prediction Decision Tree classification model and analyze the performance of engineering students based on their performances during secondary school education. The performance of students was analyzed and measured as a binomial response whether students successfully finished the first and the second study years. The developed model examined general success, number of awards obtained at competitions, special awards, average grades in mathematics, physics, and one of the official state languages during secondary school as predictor variables. The number of courses transferred from the first into the second study year and students’ GPA obtained during the first study year were added as predictor variables in the analysis and development of a prediction model for the students’ performance during the second study year and their enrollment in the third study year. Developed machine learning prediction model showed that for the performance of enrolled students in the first study year general success of students during secondary school is the most important predictor variable, followed by mathematics and physics grades. However, for the performance of the students enrolled in the second study year the most important predictor variable was number of the courses transferred from the first into the second study year, followed by students’ GPA obtained during the first study year and general success. Machine learning Decision Tree classification modeling was shown to be an adequate tool for the prediction of the performance of engineering students during the first and second study years. © The Author 2023. This work is licensed under a Creative Commons Attribution License (https://creativecommons.org/licenses/by/4.0/) that allows others to share and adapt the material for any purpose (even commercially), in any medium with an acknowledgement of the work's authorship and initial publication in this journal.;Article;10.21533/pen.v11i5.3793;https://www.scopus.com/inward/record.uri?eid=2-s2.0-85178296784&doi=10.21533%2fpen.v11i5.3793&partnerID=40&md5=1e6e79575038962b0172b47ba0214704;The topic is related to the application of Artificial Intelligence and Machine Learning in mathematics education.;Accepted;Machine learning, Decision Tree, Enrollment criteria, Engineering students, Study success;Evaluación/Predicción
An Effective Decision-Making Support for Student Academic Path Selection using Machine Learning;Houngue, Pélagie and Hountondji, Michel and Dagba, Théophile;International Journal of Advanced Computer Science and Applications;2022;Scopus;727 – 734;13;In Benin, after the GCSE (General Certificate of Secondary Education), learners can either enroll in a Technical and Vocational Education and Training (TVET), or further their studies in the general education. Majority of those who take the latter path enroll in Senior High School by choosing the Biology stream or field of study. However, most of them do not have the abilities required to succeed in this field. For instance, for the last edition of the Senior Secondary Education Certificate (French baccalaureate) held in June 2022 in Benin, the Biology field of study had a low success rate of 42%. Therefore, one may consider that there is a problem in the orientation of the students. In recent years, Machine Learning has been used in almost every field to optimize processes or to assist in decision-making. Improving academic performance has always been of general interest. And, good academic performance implies good academic orientation. The goal of this study is to optimally help learners who have just obtained their GCSE to select their field of study. For this purpose, two major elements are predicted: i) Scientific or Literary ability of students, ii) Literature or Mathematics and Physical Sciences (MPS) or Biology stream of learners. More precisely, the average marks in Mathematics, Physics and Chemistry Technology (PCT) and Biology from 6th to 9th grade for 325 students are used. Machine Learning algorithms such as Decision Tree, Random Forest, Linear Support Vector Classifier (SVC), K-Nearest Neighbors (KNN), and Logistic Regression are used to predict learners’ ability and the stream. As a result, for learners’ ability prediction, we obtained the best accuracy of 99% with the random forest algorithm for a split that reserved around 21% of the dataset for testing. As for the learners’ stream prediction, we obtained the best accuracy of 95% with the Linear SVC algorithm for a split that reserved around 20% of the dataset for testing. This study contributes to Educational Data Mining (EDM) by performing academic data exploration using numerous methods. Furthermore, it provides a tool to ease students academic path selection, which may be used by educational institutes to ensure student performance. This paper presents the steps and the outputs of the study, we performed with some recommendations for future research. © 2022, International Journal of Advanced Computer Science and Applications. All Rights Reserved.;Article;10.14569/IJACSA.2022.0131184;https://www.scopus.com/inward/record.uri?eid=2-s2.0-85143880093&doi=10.14569%2fIJACSA.2022.0131184&partnerID=40&md5=1f4bbface9914ef773be2cc42289da37;The topic is related to the application of Artificial Intelligence and Machine Learning in mathematics education.;Accepted;"Academic path; Academic performance; Educational data mining; Machine learning";Estadística/Probabilidad
Assessing the effectiveness of an artificial intelligence tutoring system for improving college-level mathematics preparedness in high school students;Nehring, Jenny and Moyer-Packenham, Patricia and North, Matt;Issues in Information Systems;2023;Scopus;128 – 141;24;Intelligent Tutoring Systems (ITS) have been used to help high school students transition from the mathematics taught in high school to the mathematics expected at colleges and universities. The purpose of this study was to examine relationships between high school students’ performance in Assessment and LEarning in Knowledge Spaces (ALEKS) Placement, Preparation, and Learning (PPL) Modules and performance on the ALEKS College Mathematics Placement Exam. The participants in this study were 100 students from five high schools in the United States. Each student was placed into one of two groups: the ALEKS Group, who completed the ALEKS Pre-Calculus Learning Modules, and the Non-ALEKS Group, who did not complete the modules. Students’ scores were compared statistically to test for significant differences. The analysis included a 2x2 mixed ANOVA to measure how assignment of the modules affected exam scores. A logistic regression was used to assess differences between the two groups in placing into college algebra. A statistically significant difference was found in exam scores between the ALEKS Group and the Non-ALEKS Group which indicated that assignment to the ALEKS PPL Pre-Calculus Learning Modules did increase performance on the ALEKS College Mathematics Placement Exam. Conversely, assignment to the ALEKS PPL Pre-Calculus Modules did not increase students’ likelihood of placing into College Algebra. The amount of time students spent taking the exam influenced student outcomes on the ALEKS Mathematics Placement exam. These results show that schools could implement Intelligent Tutoring Systems into their current mathematics classrooms to help students increase their scores on college entry mathematics placement exams. © 2023 International Association for Computer Information Systems.;Article;10.48009/1_iis_2023_111;https://www.scopus.com/inward/record.uri?eid=2-s2.0-85174258672&doi=10.48009%2f1_iis_2023_111&partnerID=40&md5=9cb2f954457c2a8a3728fdf22c48027f;The topic is related to the application of Artificial Intelligence and Machine Learning in mathematics education.;Accepted;"artificial intelligence; college mathematics preparation; intelligent tutoring systems; quantitative literacy education";Álgebra
What would the matrix do?: a systematic review of K-12 AI learning contexts and learner-interface interactions;Moore, Robert L. and Jiang, Shiyan and Abramowitz, Brian;Journal of Research on Technology in Education;2023;Scopus;7 – 20;55;This systematic review examines the empirical literature published between 2014 and 2021 that situates artificial intelligence within K-12 educational contexts. Our review synthesizes 12 articles and highlights artificial intelligence’s instructional contexts and applications in K-12 learning environments. We focused our synthesis on the learning contexts and the learner-interface interactions. Our findings highlight that most of intelligent systems are being deployed in math or informal settings. Also, there are opportunities for more collaboration to facilitate teaching and learning in domain-specific areas. Additionally, researchers can explore how to implement more collaborative learning opportunities between intelligent tutors and learners. We conclude with a discussion of the reciprocal nature of this technology integration. © 2022 ISTE.;Article;10.1080/15391523.2022.2148785;https://www.scopus.com/inward/record.uri?eid=2-s2.0-85143170742&doi=10.1080%2f15391523.2022.2148785&partnerID=40&md5=4c1cfd0c62e570b7d2b0fb2105e2e1d6;The topic is related to the application of Artificial Intelligence and Machine Learning in mathematics education.;Accepted;artificial intelligence, machine learning;Álgebra
Predicting secondary school student performance using a double particle swarm optimization-based categorical boosting model;Fan, Zongwen and Gou, Jin and Wang, Cheng;Engineering Applications of Artificial Intelligence;2023;Scopus;;124;Knowing the potential students who will fail the final exam at early stages is very challenging but important for the decision-makers in the educational institutions to take proper actions to prevent them from failure. To accurately predict the secondary school student performance, we propose a double particle swarm optimization (PSO)-based categorical boosting (P2CatBoost) model based on the demographic, school period grades, and social/school related features. Considering the machine learning models are sensitive to their hyper-parameter settings, we introduce the PSO to optimize the fitness function. In addition, the threshold of a standard binary classification task is 0.5, which might not be the optimal value in real-world applications. Thus, we optimize this threshold by the PSO. To evaluate the performance of our proposed model, two datasets downloaded from the University of California, Irvine Repository and the Kaggle, respectively, are used. The experimental results showed that our proposed P2CatBoost has the best performance in terms of all the metrics used. Our proposed P2CatBoost has the best accuracy of 96.62% and 94.45% for the final grade prediction of the Mathematics and Portuguese courses, respectively. In addition, our proposed model outperforms the other models under comparison from 4.5% to 8.3%. The statistical analyses verify that our P2CatBoost can significantly outperform the comparing models. These results confirm the effectiveness of our double PSO for improving the performance of student performance prediction, indicating our proposed model could be a useful tool in educational institutions to improve the quality of education. © 2023 Elsevier Ltd;Article;10.1016/j.engappai.2023.106649;https://www.scopus.com/inward/record.uri?eid=2-s2.0-85163036424&doi=10.1016%2fj.engappai.2023.106649&partnerID=40&md5=6f3a9d0f632d793745d02c8749a8c734;The topic is related to the application of Artificial Intelligence and Machine Learning in mathematics education.;Accepted;"CatBoost; Double particle swarm optimization; Educational data mining; Educational management";Álgebra
Study on intelligent evaluation of high school mathematics teachers' teaching reflection;Kang, Yueyuan and Yang, Fan and Wang, Wei and Zhang, Xinyuan and Liu, Weiwei;Artificial Intelligence in Education and Teaching Assessment;2022;Scopus;293 – 308;;Developing the evaluation index system for teaching reflection and carrying out evaluation practice play a critical part and serve as an important breakthrough point in facilitating teachers' professional development. To evaluate efficiently, we developed an intelligent evaluation system for high school mathematics teachers' reflection, by integrating artificial intelligence (AI) technologies with the evaluation index system and evaluation model, and making use of the semantic similarity algorithm based on the Chinese National Knowledge Infrastructure (CNKI). Then the system was tested and applied with an accuracy reaching over 80%. This indicates the preliminary realization of the development, design and application of the intelligent evaluation system for high school mathematics teachers' teaching reflection. © The Author(s), under exclusive license to Springer Nature Singapore Pte Ltd. 2022.;Book chapter;10.1007/978-981-16-6502-8_26;https://www.scopus.com/inward/record.uri?eid=2-s2.0-85152545329&doi=10.1007%2f978-981-16-6502-8_26&partnerID=40&md5=b8e25729e1ea95ed4340f624d90a0637;The topic is related to the application of Artificial Intelligence and Machine Learning in mathematics education.;Accepted;"High school mathematics; Intelligent evaluation; Teaching reflection";Pensamiento Computacional
Automated Matching of Exercises with Knowledge components;Tian, Zejie and Flanagan, Brendan and Dai, Yiling and Ogata, Hiroaki;30th International Conference on Computers in Education Conference, ICCE 2022 - Proceedings;2022;Scopus;24 – 32;1;As intelligent tutoring systems (ITS) fast develop, they have been implemented in many classrooms combing with various tutorial tools. Especially, matching exercises with knowledge components is the fundamental task of many applications, such as automatic recommendation, student knowledge tracing etc. However, manually labelling educational data is labor intensive and time consuming. Therefore, a range of machine learning methods has been proposed to address this problem, while few of them focusing on Japanese educational dataset in the real high school. In this paper, we leverage natural language processing techniques with Keyphrase extraction methods based on Japanese math exercises. We evaluate the model performance with several state-of-the-art methods and how it works in a real educational task. The results show that our methods outperform several state-of-art methods and can effectively save time for managing math exercise. © 30th International Conference on Computers in Education Conference, ICCE 2022 - Proceedings.;Conference paper;;https://www.scopus.com/inward/record.uri?eid=2-s2.0-85151060259&partnerID=40&md5=63415fd21981a6dc25036962a6dcfd8a;The topic is related to the application of Artificial Intelligence and Machine Learning in mathematics education.;Accepted;"Keyphrase extraction; knowledge components; nature language processing";Tutoría Inteligente
Predicting the Performance of Mathematics' Students through Data Mining Techniques for Enhanced Education Systems;Mauricio, Jose and Marques, Goncalo;2021 1st Conference on Online Teaching for Mobile Education, OT4ME 2021;2021;Scopus;146 – 152;;In this study, we use data mining techniques to predict the performance of students in mathematics. The failure rate in secondary education within the discipline of mathematics is significant. Therefore, predicting the performance of students is relevant to support the decision plan on interventions. A dataset with 395 records collected from two secondary schools in Portugal was used in this work. The authors tested eight machine learning algorithms such as Stochastic Gradient Descent, AdaBoost, Support Vector Machine, Naïve Bayes (NB), K-Nearest Neighbors algorithm, Decision Tree, and Logistic Regression. Consequently, this work supports future research activities to use NB to predict students' performance. Moreover, this work has ranked the impact of the variables which most disturb students from achieving success. The results recommend the NB algorithm using the top five important features which report 75.22%, 74.41%, 75.22%, and 73,29% of accuracy, precision, recall, and F1-Score, respectively. By predicting students' performance is possible to plan interventions on time and, consequently, increase the final discipline score. © 2021 IEEE.;Conference paper;10.1109/OT4ME53559.2021.9638819;https://www.scopus.com/inward/record.uri?eid=2-s2.0-85123867623&doi=10.1109%2fOT4ME53559.2021.9638819&partnerID=40&md5=75fd70f39da61ad1ef4a7fe1b387fc16;The topic is related to the application of Artificial Intelligence and Machine Learning in mathematics education.;Accepted;Education, Machine Learning, Mathematics, Naïve Bayes, Students Performance;Estadística/Probabilidad
Low-achievement risk assessment with machine learning;Zanellati, Andrea and Zingaro, Stefano P. and Gabbrielli, Maurizio;CEUR Workshop Proceedings;2023;Scopus;461 – 465;3486;In this work, we propose a method for assessing the risk of low-achievement in secondary school with data collected from the Italian ministry of education. Low-achievement is a phenomenon whereby a student, despite completing his or her education, does not reach the level of competence expected by the school system. We train three machine learning models on a large, real dataset through the INVALSI large-scale assessment tests and compare the results in terms of predictive and descriptive performance. We exploit data collected in end-of-primary school mathematics tests to predict the risk of low-achievement at the end of compulsory schooling (5 years later). The promising results of our approach suggest that it is possible to generalise the methodology for other school systems and for different teaching subjects. © 2022 Copyright for this paper by its authors. Use permitted under Creative Commons License Attribution 4.0 International (CC BY 4.0).;Conference paper;;https://www.scopus.com/inward/record.uri?eid=2-s2.0-85173839806&partnerID=40&md5=41dc7653551996d0a93a162adc7eb56d;The topic is related to the application of Artificial Intelligence and Machine Learning in mathematics education.;Accepted;"assessment test; low-achievement; machine learning; performance prediction";Evaluación/Predicción
Gea2: A Serious Game for Technology-Enhanced Learning in STEM;Ferro, Lauren S. and Sapio, Francesco and Terracina, Annalisa and Temperini, Marco and Mecella, Massimo;IEEE Transactions on Learning Technologies;2021;Scopus;723 – 739;14;Education and training are among the fields taking advantage of serious games (SGs). In this article, we present Gea 2: A New Earth, a digital SG developed as an immersive 3-D virtual learning environment, integrating several educational resources, including multimedia learning material, communication tools, and intelligent tutoring support. The game aims to complement traditional classroom activities in science, technology, engineering, and mathematics (STEM), for high school students and teachers. It incorporates an intelligent pedagogical agent that can converse in natural language with the student and provides unsolicited hints during gameplay. This article presents the game and its evaluation based on experiments involving about 100 participants. We think that the results presented here add to the research on game-based learning for STEM, by proposing a complex game system, where artificial intelligence techniques are integrated to support students' learning, and by confirming that the game experience can be attractive for the learners, also in very constrained classroom environments, such as those we operated in. © 2008-2011 IEEE.;Article;10.1109/TLT.2022.3143519;https://www.scopus.com/inward/record.uri?eid=2-s2.0-85123353158&doi=10.1109%2fTLT.2022.3143519&partnerID=40&md5=31b4ae61ec9609b2fc49ba214c61a349;The topic is related to the application of Artificial Intelligence and Machine Learning in mathematics education.;Accepted;Game-based learning, serious games (SGs), science, technology, engineering, and mathematics (STEM) edu cation, technology-enhanced learning (TEL).;Tutoría Inteligente
Identification of factors that affect the academic performance of high school students in Peru through a machine learning algorithm;Acosta, Lady Denisse Infante and Polo, Jonatán Edward Rojas;Proceedings of the LACCEI international Multi-conference for Engineering, Education and Technology;2021;Scopus;;2021-July;"The Peruvian Ministry of Education annually conducts the Student Census Evaluation (ECE, for its acronym in Spanish) to evaluate the level of learning achievement in the subjects of mathematics, reading and science and technology, both in public and private schools. The results are classified as Before beginning, Beginning, In process or Satisfactory. According to the results of the ECE 2019, it is observed that the academic performance achieved in the area of mathematics presents the highest percentage of students at the Satisfactory level (17.7%); however, in turn, said field of study is also the one that groups the highest percentage of students at the Before beginning level (33.0%). Considering the aforementioned, this research aims to identify those variables that affect the learning achievements in mathematics of high school students. Thus, for the proposed analysis, a classification model was built for each of the mentioned levels, through an ensemble machine learning algorithm that uses the gradient boosting method. As a result of the modeling, the importance of the variables analyzed was obtained, which finally identified those that have greater relevance in the prediction of the classification of each level of learning achievement. © 2021 Latin American and Caribbean Consortium of Engineering Institutions. All rights reserved.";Conference paper;10.18687/LACCEI2021.1.1.68;https://www.scopus.com/inward/record.uri?eid=2-s2.0-85122034048&doi=10.18687%2fLACCEI2021.1.1.68&partnerID=40&md5=75c44d9cf0d0d3b474be0ec3f1253fda;The topic is related to the application of Artificial Intelligence and Machine Learning in mathematics education.;Accepted;"Classification model; Educational system; Machine learning; Student academic performance";Pensamiento Computacional
A case study of using AI for General Certificate of Secondary Education (GCSE) grade prediction in a selective independent school in England;Denes, Gyorgy;Computers and Education: Artificial Intelligence;2023;Scopus;;4;The COVID-19 pandemic has created significant challenges for UK schools, but a time of cancelled exams and uncertainty around future examinations can provide opportunities to explore novel assessment methods. Hence, the 2020 proposal of the Ofqual algorithm which combines teachers' estimated grades and schools' historical performance seemed timely. However, the algorithmically calculated grades resulted in a public backlash and withdrawal of the proposal. While the failed Ofqual algorithm could be considered an example of AI, we do not yet have a thorough understanding of its numerical accuracy and how it performs in comparison to other AI models. This paper investigates this novel application: the potential use of a range of AI models as assessment tools in a selective, independent, secondary school in England. The following questions were examined: (1) how accurate are modern AI models in predicting GCSE exam grades? (2) what are the differences in model accuracy across subjects and can these be explained by qualitative differences in teachers' grading practices? Results indicate that while models yield acceptable mean absolute errors, individual mispredictions can be larger than desired. Subject differences highlighted that grading subjectivity is less significant in science, technology, engineering, and maths (STEM) subjects, which could explain why objective models fail to predict non-STEM grades more frequently. In summary, numerical results indicate that grade prediction could be an interesting novel application of AI, but more research is needed to reduce outliers. © 2023 The Author(s);Article;10.1016/j.caeai.2023.100129;https://www.scopus.com/inward/record.uri?eid=2-s2.0-85147343765&doi=10.1016%2fj.caeai.2023.100129&partnerID=40&md5=97768551a93b15f23b85c49fa084f997;The topic is related to the application of Artificial Intelligence and Machine Learning in mathematics education.;Accepted;"Grading; machine learning; grade prediction; examinations";Pensamiento Computacional
