title;author;journal;year;source;pages;volume;abstract;document_type;doi;url;selection_criteria;status;Keywords;domain_suggested
Digital Device and Mathematics: Multilevel vs Machine Learning Models for Value-added Ranking in Italy;Papa, Donatella;International Conference on Computer Supported Education, CSEDU - Proceedings;2022;Scopus;171 – 178;2;With the COVID-19 pandemic and the development of distance education programs, digital learning is popular and strategic in many learning fields. The deployment of Information and Communications Technology and its impact on both national and international learning programs are becoming increasingly significant. This study seeks to explore in the Italian context both the effectiveness of digital learning in Mathematics Education and which features and how affect value-added at the classroom level. To explore Information and Communications Technology contribution and value-added scoring, the study takes into consideration the analytical power of classical multilevel models concerning the predictive power of different types of machine learning models. The study aims to investigate how Information and Communications Technology, and related concepts, impact the Weighted Likelihood Estimates in Mathematics for students in the lower secondary school, using data from the INVALSI of the school year 2017/2018. The main finding is that Personal Computer ownership at home plays an important role in mathematical learning. Finally, a machine learning model incorporated in the educational domain can be an interesting starting point for developing class-predictive policies. Copyright © 2022 by SCITEPRESS – Science and Technology Publications, Lda. All rights reserved.;Conference paper;10.5220/0011042700003182;https://www.scopus.com/inward/record.uri?eid=2-s2.0-85140913824&doi=10.5220%2f0011042700003182&partnerID=40&md5=765f988062b15e4555211c81059220ff;The topic is related to the application of Artificial Intelligence and Machine Learning in mathematics education.;Accepted;Classification and Regression Trees;Estadística/Probabilidad
DIDACTIC ACTIVITIES ON ARTIFICIAL INTELLIGENCE: THE PERSPECTIVE OF STEM TEACHERS;Fissore, Cecilia and Floris, Francesco and Marchisio, Marina and Sacchet, Matteo;Proceedings of the 19th International Conference on Cognition and Exploratory Learning in the Digital Age, CELDA 2022;2022;Scopus;11 – 18;;"The concept of Artificial Intelligence (AI) might seem something very distant from the world of schools: a theme that is far from today's reality, especially when the education and training system is committed to tackling the problems associated with the pandemic situation. However, the impact that AI is producing in various areas of our life also requires reflection on the world of education and training. Research and education policies are therefore required to direct education to prepare students for technological challenges, enabling schools and teachers to guide innovation. It is necessary to train teachers not only on the theoretical contents inherent to these themes, but also and above all on the planning of didactic activities to adopt innovative educational approaches. The context of this research is the immersive 3-hour workshop on the theme ""Mathematics and AI"" which involved 52 teachers from all over Italy from primary to secondary school. The research questions are: What is the current teaching practice in schools in Italy in terms of AI? Which characteristics should be emphasized, and which aspects should be favored in the planning of didactic activities by school teachers? To answer the research questions, we analyzed teachers' responses to the initial questionnaire before the workshop and to the final questionnaire at the end of the workshop. Key findings show that teachers do not treat AI-related topics too much with their classes while being aware of the importance of recognizing and understanding AI. © 2022 Proceedings of the 19th International Conference on Cognition and Exploratory Learning in the Digital Age, CELDA 2022. All rights reserved.";Conference paper;;https://www.scopus.com/inward/record.uri?eid=2-s2.0-85147507436&partnerID=40&md5=ccc6191d533e5f8bc1d1e9c2c63d28bc;The topic is related to the application of Artificial Intelligence and Machine Learning in mathematics education.;Accepted;"Artificial Intelligence; Didactic Activities; Mathematics; Primary School; Secondary School; Teachers";Didactic Activities
CONIC10K: A Challenging Math Problem Understanding and Reasoning Dataset;Wu, Haoyi and Hui, Wenyang and Chen, Yezeng and Wu, Weiqi and Tu, Kewei and Zhou, Yi;Findings of the Association for Computational Linguistics: EMNLP 2023;2023;Scopus;6444 – 6458;;Mathematical understanding and reasoning are crucial tasks for assessing the capabilities of artificial intelligence (AI). However, existing benchmarks either require just a few steps of reasoning, or only contain a small amount of data in one specific topic, making it hard to analyse AI's behaviour with reference to different problems within a specific topic in detail. In this work, we propose CONIC10K, a challenging math problem dataset on conic sections in Chinese senior high school education. Our dataset contains various problems with different reasoning depths, while only the knowledge from conic sections is required. Since the dataset only involves a narrow range of knowledge, it is easy to separately analyse the knowledge a model possesses and the reasoning ability it has. For each problem, we provide a high-quality formal representation, the reasoning steps, and the final solution. Experiments show that existing large language models, including GPT-4, exhibit weak performance on complex reasoning. We hope that our findings could inspire more advanced techniques for precise natural language understanding and reasoning. Our dataset and codes are available at https://github.com/whyNLP/Conic10K. © 2023 Association for Computational Linguistics.;Conference paper;;https://www.scopus.com/inward/record.uri?eid=2-s2.0-85183310881&partnerID=40&md5=3ea4347019e885d0fad09a7e5ee912a8;The topic is related to the application of Artificial Intelligence and Machine Learning in mathematics education.;Accepted;;Teaching problem solving
A Machine Learning and Explainable AI Approach for Predicting Secondary School Student Performance;Hasib, Khan Md. and Rahman, Farhana and Hasnat, Rashik and Alam, Md. Golam Rabiul;2022 IEEE 12th Annual Computing and Communication Workshop and Conference, CCWC 2022;2022;Scopus;399 – 405;;An essential component of the educational activity is rigorous examination and assessment of students' results, with a potential substantial influence on student growth. This paper offers a predictional model for student's success in secondary education using five classification algorithms: Logistic Regression, K-Nearest Neighbors (KNN), Support Vector Machine (SVM), XGBoost, and Naive Bayes, where the data is gathered from two Portuguese school reports and surveys. The two core disciplines (Mathematics subject and Portuguese language) of the dataset were modeled around binary/five-level classification tasks which is imbalanced. The imbalanced dataset is also balanced by using K-Means SMOTE (Synthetic Minority Oversampling Technique) before classification. The test results reveal that obtaining the most outstanding accuracy value is 96.89% of Support Vector Machine (SVM) is superior to Logistic Regression, KNN, XG-Boost, and Naive Bayes. Therefore, it is essential to consider whether a model makes a particular prediction. Thus, we then train an interpretable LIME (Local Interpretable Model-agnostic Explanations) model for all the classifiers and the construction of explainable models can have a major advantage: the model can be confident, the transparency of the model helps to understand the underlying processes for working. © 2022 IEEE.;Conference paper;10.1109/CCWC54503.2022.9720806;https://www.scopus.com/inward/record.uri?eid=2-s2.0-85127631449&doi=10.1109%2fCCWC54503.2022.9720806&partnerID=40&md5=91c1f3098f09cdfb7686a5801c1f3a79;The topic is related to the application of Artificial Intelligence and Machine Learning in mathematics education.;Accepted;"Classification; Interpretable explanation; LIME; Machine learning; Prediction; Students performance";Estadística/Probabilidad
Prediction of Student Performance using Genetically Optimized Feature Selection with Multiclass Classification;Begum, Safira and Padmannavar, Sunita S.;International Journal of Engineering Trends and Technology;2022;Scopus;223 – 235;70;Educational data mining is the key aspect of improving students' performance in education. the academic performance of students or instructors can be predicted by using the techniques and algorithms in educational data mining and data mining. the paper proposed a machine learning approach to predict the academic performance of secondary school students in Mathematics and Portuguese lessons. the proposed algorithm primarily applies the normalization and z-score normalization in the pre-processing stage to solve the unbalanced class distribution problem. Then, feature selection processes are performed using a Genetic algorithm. Students' success in Mathematics and Portuguese lessons is estimated by the k-nearest neighbour (KNN), linear discriminant analysis (LDA) and support vector machine (SVM) classifications. the experimental results compare the accuracy, precision, F-score, and sensitivity values of the abovementioned methods.  © 2022 Seventh Sense Research Group®.;Article;10.14445/22315381/IJETT-V70I4P219;https://www.scopus.com/inward/record.uri?eid=2-s2.0-85129674470&doi=10.14445%2f22315381%2fIJETT-V70I4P219&partnerID=40&md5=2526022506eed785c295fdb44b70d856;The topic is related to the application of Artificial Intelligence and Machine Learning in mathematics education.;Accepted;"Educational Data Mining; K-Nearest Neighbour; Linear Discriminant Analysis; Machine Learning; Support Vector Machine";Estadística/Probabilidad
Towards explainable group formation by knowledge map based genetic algorithm;Flanagan, Brendan and Liang, Changhao and Majumdar, Rwitajit and Ogata, Hiroaki;Proceedings - IEEE 21st International Conference on Advanced Learning Technologies, ICALT 2021;2021;Scopus;370 – 372;;In recent years, machine learning of increasing complexity is being applied to problems in education. However, there is an increasing call for transparency and understanding into how the results of complex models are derived, leading to explainable AI gaining attention. The application of machine learning to automated group formation for collaborative work from learning system logs and other data has been progressing. Building on previous research in this field, we propose a group formation method that is based on a combination of course knowledge structures, reading behavior, and assessment analysis to create optimal heterogenous and homogeneous working groups using a genetic algorithm. The characteristics of each group are presented for explanation as a visualized knowledge map showing the strengths and weaknesses of each group, and are in the structure form of curriculum. We also present a case study of applying the method to junior high school mathematics log data, and provide explanation in a visualized form of standardized curriculum of group characteristics that are often referenced for learning design by teachers.  © 2021 IEEE.;Conference paper;10.1109/ICALT52272.2021.00119;https://www.scopus.com/inward/record.uri?eid=2-s2.0-85114891262&doi=10.1109%2fICALT52272.2021.00119&partnerID=40&md5=af7bc796a028132b1dba895dde5ed8d4;The topic is related to the application of Artificial Intelligence and Machine Learning in mathematics education.;Accepted;Group information, genetic algorithm, explainable;Pensamiento Computacional
A Novel Machine Learning and Artificial Intelligence Course for Secondary School Students;Mahon, Joyce and Quille, Keith and Mac Namee, Brian and Becker, Brett A.;SIGCSE 2022 - Proceedings of the 53rd ACM Technical Symposium on Computer Science Education V.2;2022;Scopus;1155;;"We present an overview of a ""Machine Learning and Artificial Intelligence""course that is part of a large online course platform for upper second level students. We take a novel approach to teaching fundamental AI concepts that does not require code, and assumes little prior knowledge including only basic mathematics. The design ethos is for students to gain an understanding of how algorithms can ""learn"". Many misconceptions exist about this term with respect to AI and can lead to confusion and more serious misconceptions, particularly for students who engage with AI-enabled tools regularly. This approach aims to provide insights into how AI actually works, to demystify and remove barriers to more advanced learning, and to emphasize the important roles of ethics and bias in AI. We took several steps to engage students, including videos narrated by a final-year second-level student (US 12th grade). We present design and logistics particulars on this course which is currently being taken by ?7,000 students in Ireland. We believe this will be of value to other educators and the wider community. © 2022 Owner/Author.";Conference paper;10.1145/3478432.3499073;https://www.scopus.com/inward/record.uri?eid=2-s2.0-85127385229&doi=10.1145%2f3478432.3499073&partnerID=40&md5=bb02488965537bcd08f00d78894c82b0;The topic is related to the application of Artificial Intelligence and Machine Learning in mathematics education.;Accepted;"ai; artificial intelligence; computing education k-12; machine learning; outreach";Didactic Activities
DIA4K12: Framework for Managing then Teaching-Learning of Artificial Intelligence at Early Ages;Labanda-Jaramillo, Milton and Chamba-Eras, Luis and Erreyes-Pinzon, Daysi and Chamba-Eras, Irene and Orellana-Malla, Angel;Lecture Notes in Networks and Systems;2022;Scopus;435 – 447;414 LNNS;"Artificial Intelligence (AI) is intervening positively in educations. UNESCO considers as a new vision to involve AI not only as a didactic medium but also as a science in which children can develop their intellect, through workshops, courses, and curricula focused on the fundamentals of AI, allowing them to develop skills such as computational and critical thinking. This research aims to design the DIA4K12 framework, which proposes the structure to support the teaching-learning process of AI in primary and secondary education. The core of the framework consists of four phases: planning, execution, process, and development; three components: open educational resources, K-12 curriculum and active methodologies; five sublevels: logical reasoning, computational thinking, and disconnected artificial intelligence, mathematics for AI, programming and machine learning; and three transversal axes: communities (communities of practice), open license (creative commons) and ethics. Finally, the framework was applied to a case study in the context of the Ecuadorian General Basic Education curriculum for the subject of Mathematics, using three phases, three components, and two sublevels. © 2022, The Author(s), under exclusive license to Springer Nature Switzerland AG.";Conference paper;10.1007/978-3-030-96293-7_36;https://www.scopus.com/inward/record.uri?eid=2-s2.0-85126199997&doi=10.1007%2f978-3-030-96293-7_36&partnerID=40&md5=c08db61e2267c32bb27544225f3f56fa;The topic is related to the application of Artificial Intelligence and Machine Learning in mathematics education.;Accepted;"Computational thinking; Education; Information technology education; Machine learning; School curriculum";Pensamiento Computacional
Learning with Interactive Knowledge Representations;Bredeweg, Bert and Kragten, Marco and Holt, Joanna and Kruit, Patricia and van Eijck, Tom and Pijls, Monique and Bouwer, Anders and Sprinkhuizen, Malou and Jaspar, Emile and de Boer, Muriel;APPLIED SCIENCES-BASEL;2023;Web Of Science;5256;13;Computers are promising tools for providing educational experiences that meet individual learning needs. However, delivering this promise in practice is challenging, particularly when automated feedback is essential and the learning extends beyond using traditional methods such as writing and solving mathematics problems. We hypothesize that interactive knowledge representations can be deployed to address this challenge. Knowledge representations differ markedly from concept maps. Where the latter uses nodes (concepts) and arcs (links between concepts), a knowledge representation is based on an ontology that facilitates automated reasoning. By adjusting this reasoning towards interacting with learners for the benefit of learning, a new class of educational instruments emerges. In this contribution, we present three projects that use an interactive knowledge representation as their foundation. DynaLearn supports learners in acquiring system thinking skills. Minds-On helps learners to deepen their understanding of phenomena while performing experiments. Interactive Concept Cartoons engage learners in a science-based discussion about controversial topics. Each of these approaches has been developed iteratively in collaboration with teachers and tested in real classrooms, resulting in a suite of lessons available online. Evaluation studies involving pre-/post-tests and action-log data show that learners are easily capable of working with these educational instruments and that the instruments thus enable a semi-automated approach to constructive learning.;Article;10.3390/app13095256;;The topic is related to the application of Artificial Intelligence and Machine Learning in mathematics education.;Accepted;knowledge representationlearning by modellingscience educationK-12;Evaluación/Predicción
K-12 Education in the Age of AI: A Call to Action for K-12 AI  Literacy;Wang, Ning and Lester, James;INTERNATIONAL JOURNAL OF ARTIFICIAL INTELLIGENCE IN EDUCATION;2023;Web Of Science;228--232;33;"The emergence of increasingly powerful AI technologies calls for the design and development of K-12 AI literacy curricula that can support students who will be entering a profoundly changed labor market. However, developing, implementing, and scaling AI literacy curricula poses significant challenges. It will be essential to develop a robust, evidence-based AI education research foundation that can inform AI literacy curriculum development. Unlike K-12 science and mathematics education, there is not currently a research foundation for K-12 AI education. In this article we provide a component-based definition of AI literacy, present the need for implementing AI literacy education across all grade bands, and argue for the creation of research programs across four areas of AI education: (1) K-12 AI Learning \& Technology; (2) K-12 AI Education Integration into STEM, Language Arts, and Social Science Education; (3) K-12 AI Professional Development for Teachers and Administrators; and (4) K-12 AI Assessment.";Article;10.1007/s40593-023-00358-x;;The topic is related to the application of Artificial Intelligence and Machine Learning in mathematics education.;Accepted;AI educationK-12 educationK-12 AI educationComputer science education;Evaluación/Predicción
Deep learning practice for high school student engagement in STEM careers;Santana, Otacilio Antunes and de Sousa, Barbara Alves and do Monte, Sandra Razana Silva and de Freitas Lima, Mayara Lopes and Ferraz e Silva, Caina;IEEE;2020;Web Of Science;164--169;;The use of deep learning activities at the educational stage is quite relevant for student engagement (positive or negative) in Science, Technology, Engineering, and Mathematics (STEM) careers. Physical contact with hardware, visual and interactive contact with software, and contact with algorithms are practices in which students observe the complexity of command could result in ingenious automation and task accomplishment (universal approximation theorem and/or probabilistic inference). Deep learning came to this work as a tool for solving a problem: How do we identify forage palm (Opuntia ficus-indica Mill, Cactaceae) for feeding goats, in an area under Semi-arid climate? High school students on advisory teachers of various disciplines (biology, chemical, physical, mathematics, geography, and others) attempt to answer to this question: Did student engagement happen by new context, problem to be solved, data collection (hardware), or data analysis (algorithm and software)? Sixty-seven high school students from Brazilian public schools (from 14 to 17 years old) participated in the proposed following teacher. High school students get more involved by practical and technological issues (mechanisms and hardware) than in scenario (new context) or by evaluation and discussion of the purpose. This data about the preference of one stage over other stages of Deep Learning determined the application for undergraduate courses in STEM. This was the most relevant data of this work, despite total engagement, students' preferences in one stage point out the student's academic vocation.;Article;10.1109/educon45650.2020.9125281;;The topic is related to the application of Artificial Intelligence and Machine Learning in mathematics education.;Accepted;K-12 EducationEngineering CareerProblem-Based LearningEngineering EducationRemote Labs;Pensamiento Computacional
The Dynamic Vectors-Based Attention Model for Chinese Mathematical Term Extraction;Zhong, Maosheng and Kuang, Jiangling and Liu, GanLin and Hua, Xin and Wu, Jiahua;IEEE INTELLIGENT SYSTEMS;2023;Web Of Science;12--20;38;Term extraction aims to extract domain-specific terminology from documents. Secondary school mathematics terminology plays a guiding role in the learning and teaching of secondary school mathematics. We found that there needs to be more work in this field and that there are two main issues in extracting the terms from the middle school mathematics text: the polysemy of one character problem and nested terms problem. Accordingly, we have constructed a secondary school mathematics corpus and proposed a model to resolve these problems, termed BERT-LLA-CRF. Using pretraining to obtain dynamic word vectors to improve the model's understanding of text semantics and solve the problem of multiple meanings of one word, the proposed model integrates attention mechanisms and Chinese character information to solve the nested terminology problem. The experiment results show that the proposed model effectively solves those problems and achieves good middle-school mathematics term extraction results.;Article;10.1109/MIS.2023.3246240;;The topic is related to the application of Artificial Intelligence and Machine Learning in mathematics education.;Accepted;Mathematical modelsTerminologyTask analysisData miningSemanticsLatticesComputational modeling;Didactic Activities
A Practical Model for Educators to Predict Student Performance in K-12 Education using Machine Learning;Harvey, Julie L. and Kumar, Sathish A. P.;2019 IEEE Symposium Series on Computational Intelligence, SSCI 2019;2019;Scopus;3004 – 3011;;Predicting classifiers can be used to analyze data in K-12 education. Creating a classification model to accurately identify factors affecting student performance can be challenging. Much research has been conducted to predict student performance in higher education, but there is limited research in using data science to predict student performance in K-12 education. Predictive models are developed and examined in this review to analyze a K-12 education dataset. Three classifiers are used to develop these predictive models, including linear regression, decision tree, and Naive Bayes techniques. The Naive Bayes techniques showed the highest accuracy when predicting SAT Math scores for high school students. The results from this review of current research and the models presented in this paper can be used by stakeholders of K-12 education to make predictions of student performance and be able to implement intervention strategies for students in a timely manner. © 2019 IEEE.;Conference paper;10.1109/SSCI44817.2019.9003147;https://www.scopus.com/inward/record.uri?eid=2-s2.0-85080951846&doi=10.1109%2fSSCI44817.2019.9003147&partnerID=40&md5=ce7f78f9f064b2f268ba910be1411331;The topic is related to the application of Artificial Intelligence and Machine Learning in mathematics education.;Accepted;;Estadística/Probabilidad
